{
  "schema_version": 1,
  "id": "forensics-basics",
  "name": "Forensics basics",
  "description": "File-system examination, carving, and artifact extraction tools for owned evidence.",
  "authors": ["@johnnypatty"],
  "tags": ["forensics", "defensive"],
  "packages": ["blackarch:autopsy", "blackarch:bulk-extractor", "blackarch:scalpel"],
  "license": "CC0-1.0",
  "reviewed": true
}
